{
  "profile_id": "weekly-l3-recovery",
  "seed": 30301,
  "expected_outcome": "recovered",
  "delayed_calls": [
    {
      "target": "harness::send",
      "delay_ms": 750,
      "occurrences": 1
    }
  ],
  "fail_first_attempt": [
    "coordination-child-1"
  ],
  "duplicate_events": true,
  "child_timeout_ms": 10000,
  "out_of_order_results": true
}
